{
  "manifest_version": "1.0.0",
  "target_environment": {
    "name": "custom-dev-environment",
    "description": "Environment for: Necesito un entorno para aprender Inteligencia Artificial con Python y herramientas de visualizaci√≥n de datos.",
    "inferred_languages": [
      "JavaScript",
      "Python"
    ],
    "inferred_frameworks": [
      "Node.js"
    ]
  },
  "packages": [
    {
      "package_id": "Git.Git",
      "display_name": "Git",
      "package_manager": "winget",
      "version_requirement": "latest",
      "version_check_command": "git --version",
      "installation_flags": [
        "--silent"
      ],
      "priority_level": 10,
      "is_critical": true,
      "category": "tool"
    },
    {
      "package_id": "OpenJS.NodeJS.LTS",
      "display_name": "Node.js LTS",
      "package_manager": "winget",
      "version_requirement": "latest",
      "version_check_command": "node --version",
      "installation_flags": [
        "--silent"
      ],
      "priority_level": 20,
      "is_critical": true,
      "category": "runtime"
    },
    {
      "package_id": "Python.Python.3.11",
      "display_name": "Python 3.11",
      "package_manager": "winget",
      "version_requirement": "3.11",
      "version_check_command": "python --version",
      "installation_flags": [
        "--silent"
      ],
      "priority_level": 25,
      "is_critical": true,
      "category": "runtime"
    },
    {
      "package_id": "Microsoft.VisualStudioCode",
      "display_name": "Visual Studio Code",
      "package_manager": "winget",
      "version_requirement": "latest",
      "version_check_command": "code --version",
      "installation_flags": [
        "--silent"
      ],
      "priority_level": 50,
      "is_critical": false,
      "category": "ide"
    }
  ],
  "environment_variables": [],
  "post_install_commands": [
    {
      "command": "npm install -g typescript",
      "description": "Install TypeScript globally",
      "requires_restart": false,
      "is_critical": false
    }
  ],
  "ai_reasoning": "Standard development environment with Git, Node.js, Python, and VS Code."
}